{
  "cycle_type": "cycle_n_expansion",
  "status": "completed",
  "feature_name": "write_weekly_ai_trending_x_accounts_markdown",
  "pains": [
    "x のネタ元のアカウントを自分で探すと時間がかかるので、AI 系の github trending に集まっているトップコントリビューターの x アカウントをまとめて一覧で見たい",
    "スター数順ではなく本当の github trending（今週）から取りたい。x アカウントが無い人は一覧に要らない",
    "実際に動かして一覧を Markdown ファイルで見たい。GITHUB_TOKEN を使ってレート制限に当たらないようにしたい"
  ],
  "runtime": {
    "language": "python 3.10 + Pydantic (existing stack)",
    "dependencies": [
      "pytest — Cycle 1, test runner already used by the existing tests (constitution 2)",
      "mypy — Cycle 1, static type check required by constitution 1"
    ],
    "setup_command": "",
    "test_command": "python3 -m pytest -v",
    "format_command": "",
    "test_file_convention": "core/foo.py -> tests/core/test_foo.py (tests/ mirrors the source tree)",
    "harness_files": [
      "requirements.txt",
      "mypy.ini"
    ]
  },
  "current_baseline": {
    "test_status": "all_green",
    "features": [
      {
        "name": "github_trending_x_accounts",
        "source": "github trending に集まっているトップコントリビューターの x アカウントを",
        "file": "core/github_contributors.py",
        "symbol": "list_contributor_x_accounts",
        "interface": {
          "input": "get_json: Callable[[str], Any], trending_url: str = TRENDING_URL",
          "output": "str — one Markdown line '- @<handle> (<login>, <owner/repo>) https://x.com/<handle>\\n' for the first trending repo's first contributor; calls get_json for the trending, contributors and user URLs"
        }
      },
      {
        "name": "weekly_github_trending_x_accounts",
        "source": "本当の github trending（今週）から取りたい",
        "file": "core/github_contributors.py",
        "symbol": "list_weekly_trending_x_accounts",
        "interface": {
          "input": "get_text: Callable[[str], str], get_json: Callable[[str], Any]",
          "output": "str — one Markdown line '- @<handle> (<login>, <owner/repo>) https://x.com/<handle>\\n' for the first repo on https://github.com/trending?since=weekly and its first contributor; calls get_text for the trending page and get_json for the contributors and user URLs"
        }
      },
      {
        "name": "skip_contributors_without_x_account",
        "source": "x アカウントが無い人は一覧に要らない",
        "file": "core/github_contributors.py",
        "symbol": "list_weekly_trending_x_accounts",
        "interface": {
          "input": "get_text: Callable[[str], str], get_json: Callable[[str], Any]",
          "output": "str — one Markdown line for the first contributor (in contributors order) of the first weekly trending repo whose twitter_username is non-empty; contributors with None or \"\" are skipped; \"\" if none has one"
        }
      },
      {
        "name": "aggregate_weekly_trending_x_accounts",
        "source": "まとめて一覧で見たい",
        "file": "core/github_contributors.py",
        "symbol": "collect_weekly_trending_x_accounts",
        "interface": {
          "input": "get_text: Callable[[str], str], get_json: Callable[[str], Any]",
          "output": "str — Markdown list, one line per unique x handle, from the first 3 contributors of every repo on https://github.com/trending?since=weekly (trending order, then contributors order); contributors without twitter_username are skipped; calls get_json once per repo and once per contributor"
        }
      },
      {
        "name": "filter_ai_weekly_trending_x_accounts",
        "source": "AI 系の",
        "file": "core/github_contributors.py",
        "symbol": "collect_weekly_ai_trending_x_accounts",
        "interface": {
          "input": "get_text: Callable[[str], str], get_json: Callable[[str], Any]",
          "output": "str — same Markdown list as collect_weekly_trending_x_accounts, limited to weekly trending repos whose GET /repos/{owner}/{repo} topics include \"ai\" or \"llm\"; calls get_json once per repo for topics, then contributors and users for matching repos"
        }
      },
      {
        "name": "write_weekly_ai_trending_x_accounts_markdown",
        "source": "実際に動かして一覧を Markdown ファイルで見たい",
        "file": "core/github_contributors.py",
        "symbol": "write_weekly_ai_trending_x_accounts",
        "interface": {
          "input": "path: str, get_text: Callable[[str], str], get_json: Callable[[str], Any]",
          "output": "None — writes collect_weekly_ai_trending_x_accounts(get_text, get_json) to path as UTF-8 (overwrites); CLI entry `python3 -m core.github_contributors <path>` uses unauthenticated urllib"
        }
      }
    ]
  },
  "target_increment": {
    "focus": "",
    "source": "",
    "acceptance_criteria": {
      "given": "",
      "when": "",
      "then": ""
    },
    "extension_point": ""
  },
  "execution_steps": [],
  "assumptions": [
    "GitHub に公式の trending API はないため、今週の trending は https://github.com/trending?since=weekly の HTML から取る（Cycle 1 の Search API による代用はスター数順だったため置き換える）。",
    "トップコントリビューターは GET /repos/{owner}/{repo}/contributors の先頭（コミット数順）とする。",
    "x アカウントは GET /users/{login} の twitter_username フィールドから取る。",
    "一覧は Markdown の箇条書きで、1行の形式は「- @<x_handle> (<github_login>, <owner/repo>) https://x.com/<x_handle>」とする。",
    "Cycle 1 は trending 先頭のリポジトリ1件・その先頭のコントリビューター1人だけを扱う。",
    "trending ページの各リポジトリは <article class=\"Box-row\"> 内の <h2> の <a href=\"/<owner>/<repo>\"> で表され、その href から先頭の / を除いたものを owner/repo とする。",
    "trending ページの HTML 取得は JSON 取得とは別の関数 get_text(url) -> str として注入する。",
    "今回も trending 先頭のリポジトリ1件・その先頭のコントリビューター1人だけを扱う。",
    "twitter_username が None または空文字のコントリビューターは「x アカウントが無い人」とみなし、contributors の順に次の人を見る。",
    "今回も trending 先頭のリポジトリ1件だけを扱い、出す行は x アカウントを持つ最初のコントリビューター1人分だけとする。",
    "一覧の対象は今週の trending ページに載っているすべてのリポジトリ（<article class=\"Box-row\"> の出現順）とする。",
    "「トップコントリビューター」は各リポジトリの contributors の先頭3人（x アカウントの有無に関係なく順位で数える）とし、そのうち x アカウントを持つ人だけを出す。",
    "同じ x アカウントが複数のリポジトリに現れたときは、最初に出たリポジトリの1行だけを残す。",
    "行の並びはリポジトリの trending 順、その中は contributors の順とする。",
    "まとめた一覧は既存関数を変えずに新しい関数 collect_weekly_trending_x_accounts として追加する。",
    "「AI 系」のリポジトリは、GET /repos/{owner}/{repo} の topics に \"ai\" または \"llm\" を含むものとする。",
    "絞り込み以外（先頭3人、x アカウントの無い人の除外、重複除去、並び順、行の形式）は collect_weekly_trending_x_accounts と同じとする。",
    "絞り込んだ一覧は既存関数を変えずに新しい関数 collect_weekly_ai_trending_x_accounts として追加する。",
    "Markdown ファイルに書く一覧は collect_weekly_ai_trending_x_accounts（AI 系に絞った今週の trending）の結果とし、見出しなどは足さずそのまま書く。",
    "書き出し先のパスは引数で受け取り、既にファイルがあれば上書きする。",
    "実際に動かす入口は python3 -m core.github_contributors <出力パス> とし、出力先は gitignore 済みの outputs/ 配下を想定する。",
    "GITHUB_TOKEN は環境変数から読み、GitHub API へのリクエストに Authorization: Bearer <token> ヘッダーとして付ける（次の増分）。"
  ],
  "wont": [
    {
      "item": "X (Twitter) API を使ったフォロワー数取得や自動フォロー",
      "keyword": "フォロー"
    },
    {
      "item": "一覧をブラウザで見るための Web 画面",
      "keyword": "画面"
    }
  ],
  "next_sprint_backlog": [
    {
      "item": "環境変数 GITHUB_TOKEN があるとき、GitHub API への JSON 取得リクエストに Authorization: Bearer <token> ヘッダーを付ける",
      "source": "GITHUB_TOKEN を使ってレート制限に当たらないようにしたい"
    }
  ],
  "dropped_backlog": [],
  "proposals": [
    "twitter_username が空のコントリビューターを一覧から除外する（またはその旨を表示する）",
    "GitHub API のレート制限・エラー時のリトライや GITHUB_TOKEN による認証",
    "一覧を outputs/ に Markdown ファイルとして書き出す CLI エントリポイント",
    "日次バッチ（run_daily.sh / LangGraph）への組み込み",
    "どのコントリビューターも x アカウントを持たない場合の戻り値（空文字など）を決めてテストする",
    "上位何人までを対象にするか（現在は3人と仮定）を引数で変えられるようにする",
    "AI 系とみなす topics（現在は ai / llm と仮定）を machine-learning / deep-learning / agents などに広げる、または引数で変えられるようにする",
    "Markdown ファイルに日付入りの見出しを付ける、またはファイル名を outputs/YYYY-MM-DD_x_accounts.md にする",
    "GITHUB_TOKEN が無いときに警告を出す、またはレート制限（403/429）時に分かるエラーで止める"
  ]
}
